{
  "schema_version": 1,
  "outcome_id": "outcome_01J5XKA5E8H1L4N7Q0T3W6Z9B",
  "task_id": "task_01J5XK7Q2A6M8N4P0R3S5T7V9W",
  "accepted": "accepted",
  "signals": {
    "build": null,
    "tests": null,
    "lint": null,
    "typecheck": null,
    "completion": null,
    "pr": null,
    "correction": null,
    "rollback": null,
    "retry": null
  },
  "evidence_refs": [],
  "observed_at": "2026-08-09T10:34:12Z"
}
